row_number,source,author,title,description,url,category,coverage
253,ABC News,G. Elliott Morris,"Trump has gained in 538's forecast, but the election is still a toss-up","538's 2024 presidential election forecast shows a very close, toss-up race, with Trump taking a small lead.",https://abcnews.go.com/538/trump-gained-538s-forecast-election-toss/story?id=114907042,Election Dynamics,Neutral
255,ABC News,"Nicholas Kerr, Brittany Shepherd",How Nebraska’s 'blue dot' could prove pivotal in the Electoral College,The 2nd Congressional District could also be key to Democrats' Senate hopes.,https://abcnews.go.com/Politics/nebraskas-blue-dot-prove-pivotal-electoral-college/story?id=115274378,Election Dynamics,Neutral
256,ABC News,Sarah Beth Hensley,What are the key issues for voters in swing states that could decide election?,"While many battlegrounds share the same concerns as the rest of Americans, there are some issues that stand out as top concerns.",https://abcnews.go.com/Politics/key-issues-voters-swing-states-decide-election/story?id=115359821,Election Dynamics,Neutral
258,Al Jazeera English,Al Jazeera Staff,"US election: 14 days left — What polls say, what Harris and Trump are up to",Kamala Harris and Donald Trump are campaigning through key battleground states as the election race remains tight.,https://www.aljazeera.com/news/2024/10/22/us-election-14-days-left-what-polls-say-what-harris-and-trump-are-up,Election Dynamics,Neutral
260,Al Jazeera English,,Harris makes final pitch to voters one week before US election,Democratic presidential candidate Kamala Harris made her final pitch to voters one week before the US election.,https://www.aljazeera.com/program/newsfeed/2024/10/30/harris-makes-final-pitch-to-voters-one-week-before-us-election,Election Dynamics,Neutral
261,Al Jazeera English,Al Jazeera,Fact-check: Donald Trump’s Madison Square Garden rally in New York City,Trump rallied his MAGA troops with angry words about immigration and mocked Kamala Harris. We fact check his claims.,https://www.aljazeera.com/news/2024/10/28/fact-check-donald-trumps-madison-square-garden-rally-in-new-york-city,Election Dynamics,Neutral
262,Al Jazeera English,Al Jazeera Staff,Trump attacks Harris at mega-rally at New York’s Madison Square Garden,Donald Trump and Kamala Harris rally supporters as US election race remains too close to call entering final stretch.,https://www.aljazeera.com/news/2024/10/28/trump-attacks-harris-at-mega-rally-at-new-yorks-madison-square-garden,Election Dynamics,Neutral
265,Al Jazeera English,,Harris supporters disperse after election night speech postponed,"Kamala Harris supporters were seen leaving her watch party in Washington DC, after her speech was postponed.",https://www.aljazeera.com/program/newsfeed/2024/11/6/harris-supporters-disperse-after-election-night-speech-postponed,Election Dynamics,Neutral
266,Al Jazeera English,Al Jazeera Staff,State of the race: Five takeaways 17 days out from the US election,What's the latest on the race between Kamala Harris and Donald Trump? Al Jazeera breaks down the week's election news.,https://www.aljazeera.com/news/2024/10/20/state-of-the-race-five-takeaways-seventeen-days-out-from-us-election,Election Dynamics,Neutral
268,ABC News,Tal Axelrod,Democrats sift through 'unmitigated disaster' after Trump victory: ANALYSIS,"Democrats hoped that voters wanted to move on from Donald Trump. Instead, they wanted more of him.",https://abcnews.go.com/Politics/democrats-sift-unmitigated-disaster-after-trump-victory-analysis/story?id=115579655,Election Dynamics,Neutral
269,ABC News,"Lalee Ibssa, Soo Rin Kim, Kelsey Walsh",Trump to rally in iconic Madison Square Garden,"In the final week of his campaign, former President Donald Trump will cross off a campaign bucket list item on Sunday: a rally in the iconic Madison Square Garden.",https://abcnews.go.com/Politics/trump-rally-iconic-madison-square-garden/story?id=115142917,Election Dynamics,Neutral
275,ABC News,Geoffrey Skelley,What would happen if Harris and Trump tie in the Electoral College?,"The race would go to Congress, where Republicans would likely have an advantage.",https://abcnews.go.com/538/happen-harris-trump-tie-electoral-college/story?id=114980672,Election Dynamics,Neutral
276,ABC News,ABC News,WATCH: World reacts to 2024 presidential election results,World leaders and top officials are reacting to the unfolding results of the 2024 presidential election as the contest draws to an apparent conclusion.,https://abcnews.go.com/Politics/video/world-reacts-2024-presidential-election-results-115555637,Election Dynamics,Neutral
281,ABC News,"Alexandra Hutzler, David Brennan, Meredith Deliso, Julia Reinstein, Lucien Bruggeman",Election security updates: Officials brace for Election Day under cloud of threats,Follow the latest election-related security issues and legal challenges.,https://abcnews.go.com/Politics/live-updates/election-safety-2024/?id=115455767,Election Dynamics,Neutral
282,ABC News,"Ashley Ennis, Doc Louallen",Voter van makes casting a ballot easy for some Pennsylvania residents,"With less than two weeks to Election Day, one Pennsylvania county has unveiled a new mobile voter services van that aims to make voting more accessible for residents.",https://abcnews.go.com/Politics/voter-van-makes-casting-ballot-easy-pennsylvania-residents/story?id=115102138,Election Dynamics,Neutral
288,Al Jazeera English,"Maram Humaid, Aziza Nofal, Mat Nashed","What do people in Gaza, West Bank and Lebanon think about the US election?",People in the Middle East answer who they think will be a better US president for them - Kamala Harris or Donald Trump.,https://www.aljazeera.com/news/2024/11/4/what-do-people-in-gaza-west-bank-and-lebanon-think-about-the-us-election,Election Dynamics,Neutral
291,Al Jazeera English,Al Jazeera,Harris or Trump? Voting under way in US election after turbulent race,Democrat Kamala Harris and Republican Donald Trump are going head-to-head in a race that remains too close to call.,https://www.aljazeera.com/gallery/2024/11/5/harris-or-trump-voting-under-way-in-us-election-after-turbulent-race,Election Dynamics,Neutral
294,ABC News,"Alexandra Hutzler, Molly Nagle",Trump and Biden both call for smooth transition in historic Oval Office meeting,President-elect Donald Trump was welcomed at the White House on Wednesday after declining to do the same for President Joe Biden after the 2020 election.,https://abcnews.go.com/Politics/biden-trump-meet-oval-office-post-election-tradition/story?id=115785681,Election Dynamics,Neutral
296,Time,Chantelle Lee,What Happens if a Candidate Contests the Results of the 2024 Election?,"From recount rules to post-election litigation, here's what would happen if a candidate contests the election results.",https://time.com/7172058/trump-harris-2024-contest-election-results-how/,Election Dynamics,Neutral
297,Time,Chad de Guzman,Trump Declares Election Victory in Speech to Supporters,"While the AP had not yet called the election, Trump possessed a commanding lead by the time he addressed his supporters.",https://time.com/7173254/trump-election-victory-speech/,Election Dynamics,Neutral
312,ABC News,"Geoffrey Skelley, Mary Radcliffe, Julian Kim, Geoffrey Skelley",The 2024 election could hinge on Pennsylvania,538's final deep dive into swing states in the 2024 election focusing on Pennslyvania voters.,https://abcnews.go.com/538/2024-election-hinge-pennsylvania/story?id=115248967,Election Dynamics,Neutral
314,ABC News,Alexandra Hutzler,What you need to know about the Electoral College as 2024 race nears end,Here's everything you need to know about the Electoral College as the 2024 presidential race nears its end,https://abcnews.go.com/Politics/what-is-electoral-college/story?id=115072002,Election Dynamics,Neutral
316,ABC News,Tal Axelrod,Democrats have tried to block third- party candidates. They could still be spoilers,"Less than a week before Election Day, third-party candidates still present an unknown factor in key swing states where dozens of Electoral College votes are up for grabs.",https://abcnews.go.com/Politics/democrats-hard-block-party-candidates-spoilers/story?id=115273808,Election Dynamics,Neutral
319,Al Jazeera English,Al Jazeera,"Kamala Harris, Donald Trump rallying in Wisconsin in final US election push",Rival presidential candidates remain locked in a tight race four days before election day.,https://www.aljazeera.com/news/2024/11/1/kamala-harris-donald-trump-rallying-in-wisconsin-in-final-us-election-push,Election Dynamics,Neutral
322,Al Jazeera English,Al Jazeera Staff,"Polls open for 2024 US Election Day as Kamala Harris, Donald Trump face off","This Election Day culminates a campaign season defined by historic twists, but the results may be slow in coming.",https://www.aljazeera.com/news/2024/11/5/polls-open-for-2024-us-election-day-as-kamala-harris-donald-trump-face-off,Election Dynamics,Neutral
327,Business Insider,bgriffiths@insider.com (Brent D. Griffiths),"Economic concerns are top of voters' minds, but Kamala Harris is choosing a different path for her closing argument","Kamala Harris is betting voters can hear two messages at once, but she is leaning hard into anti-Trump attacks in the final weeks before Election Day.",https://www.businessinsider.com/harris-closing-message-trump-john-kelly-fascist-2024-10,Election Dynamics,Neutral
328,Business Insider,"insider@insider.com (John L. Dorman,Brent D. Griffiths)","Trump wins Pennsylvania, the most important swing state in the 2024 election",Pennsylvania and its 19 electoral votes were widely considered to be the most likely tipping point in the race between Kamala Harris and Donald Trump.,https://www.businessinsider.com/pennsylvania-election-results-trump-harris-blue-wall-2024-11,Election Dynamics,Negative
337,Al Jazeera English,Al Jazeera Staff,"US election: 4 days left – What polls say, what Harris and Trump are up to","On Friday Trump heads to Michigan, while Harris will focus on Wisconsin.",https://www.aljazeera.com/news/2024/11/1/us-election-4-days-left-what-polls-say-what-harris-and-trump-are-up-to,Election Dynamics,Neutral
339,Al Jazeera English,Al Jazeera Staff,"US election: 10 days left – What polls say, what Harris and Trump are up to",Harris to campaign with Michelle Obama in Michigan while Trump will have stops in Michigan and Pennsylvania.,https://www.aljazeera.com/news/2024/10/26/us-election-10-days-left-what-polls-say-what-harris-and-trump-are-up,Election Dynamics,Neutral
345,ABC News,Emily Chang,Notable firsts that could make history on Election Day,The stage is set for a historic 2024 election in congressional as well as in the White House races.,https://abcnews.go.com/Politics/notable-firsts-make-history-election-day/story?id=115532002,Election Dynamics,Neutral
350,ABC News,Geoffrey Skelley,Republicans won the Senate,How big will the Republicans' U.S. Senate majority be?,https://abcnews.go.com/538/republicans-won-senate/story?id=115556734,Election Dynamics,Negative
357,Time,Robert B. Mitchell / Made by History,The Long History of the ‘October Surprise’,Last minute disclosures or revelations can play an outsized role in the last weeks before an election.,https://time.com/7095847/october-surprise-history/,Election Dynamics,Neutral
365,Al Jazeera English,Al Jazeera,"Trump leading Harris among Arab Americans, poll suggests",The poll is the latest warning sign to Democrats that the war in Gaza is costing support among a key voting bloc.,https://www.aljazeera.com/news/2024/10/22/trump-leading-harris-among-arab-americans-poll-suggests,Election Dynamics,Negative
369,Al Jazeera English,Al Jazeera Staff,"US election: 6 days left – What polls say, what Harris and Trump are up to","With just six days remaining before the election, both candidates are rallying support in key swing states.",https://www.aljazeera.com/news/2024/10/30/us-election-6-days-left-what-polls-say-what-harris-and-trump-are-up,Election Dynamics,Neutral
370,Al Jazeera English,Inside Story,"What’s the focus for Harris, Trump in the last few days of the US campaign?",Opinion polls suggest the US presidential election is tight.,https://www.aljazeera.com/program/inside-story/2024/10/28/whats-the-focus-for-harris-trump-in-the-last-few-days-of-the-us-campaign,Election Dynamics,Neutral
372,Al Jazeera English,Al Jazeera,Donald Trump claims US election victory after winning key swing states,"The Republican candidate is on the cusp of winning 270 Electoral College votes, per the Associated Press.",https://www.aljazeera.com/news/2024/11/6/donald-trump-claims-win-kamala-harris,Election Dynamics,Negative
386,Al Jazeera English,Gabriela Barzallo,US election campaigns shift strategies as Latino voter allegiances change,"Latinos have long been considered Democratic supporters, but the demographic has been shifting to the right.",https://www.aljazeera.com/news/2024/11/3/us-election-campaigns-shift-strategies-as-latino-voter-allegiances-change,Election Dynamics,Negative
390,NBC News,Ben Kamisar and Alex Seitz-Wald and Natasha Korecki and Bridget Bowman,Democrats won 4 big Senate races in states Harris lost. Their ads looked very different.,"Vice President Kamala Harris couldn’t win Wisconsin, Michigan, Nevada or Arizona. But her party still did: Democratic Senate candidates in each of those battlegrounds emerged victorious, even as voters rejected Harris.",https://www.nbcnews.com/politics/2024-election/democrats-won-4-big-senate-races-states-harris-lost-ads-looked-differe-rcna179668,Election Dynamics,Negative
392,Al Jazeera English,Al Jazeera Staff,"US election: 3 days left – What polls say, what Harris and Trump are up to","Harris and Trump are locked in a dead heat, battling for control of Midwestern swing states.",https://www.aljazeera.com/news/2024/11/2/us-election-3-days-left-what-polls-say-what-harris-and-trump-are-up-to,Election Dynamics,Neutral
395,CBC News,,Donald Trump to become U.S. president again,Republican Donald Trump will become the 47th president of the United States after beating Democratic candidate Kamala Harris in the election to complete a stunning political comeback.,https://www.cbc.ca/news/world/us-presidency-trump-wins-1.7375086,Election Dynamics,Negative
396,Al Jazeera English,Al Jazeera Staff,"US election: The day after – What results say; what Harris, Trump are up to","It's too close to call, but Trump's wins in Georgia and North Carolina give him more pathways to success than Harris.",https://www.aljazeera.com/news/2024/11/6/us-election-the-day-after-what-results-say-what-harris-trump-are-up-to,Election Dynamics,Negative
402,Al Jazeera English,Al Jazeera,"US election: It’s voting day – What polls say; what Harris, Trump are up to",Harris and Trump spent the eve of Election Day campaigning across swing states in a final push for votes.,https://www.aljazeera.com/news/2024/11/5/us-election-zero-days-left-what-polls-say-what-harris-and-trump-are-up-to,Election Dynamics,Neutral
403,Al Jazeera English,Mohammed Haddad,Route to 270: How Trump or Harris would win the US election,"As the US election approaches, we explore the Electoral College routes for Trump and Harris to secure the presidency.",https://www.aljazeera.com/news/2024/10/31/route-to-270-how-trump-or-harris-would-win-the-us-election,Election Dynamics,Neutral
407,ABC News,Tal Axelrod,"In key New York suburb, House candidates are racing to the center: ANALYSIS","In New York's 17th Congressional District, the candidates here aren't like the Republicans or Democrats voters have heard about in Washington. Just trust them.",https://abcnews.go.com/Politics/race-center-ny-suburbs-showcasing-candidates-moderate/story?id=115224285,Election Dynamics,Neutral
409,ABC News,Tal Axelrod,5 races to watch that will decide control of the Senate,Senate Democrats head into Tuesday's elections defending a 51-49 majority; Republicans call it their best opportunity in a decade to gain ground.,https://abcnews.go.com/Politics/5-races-watch-decide-control-senate/story?id=115359937,Election Dynamics,Neutral
410,Al Jazeera English,Al Jazeera,"Early voting in full swing in US election, Harris and Trump tied in polls",As the US election enters final two weeks the candidates are focusing on swing states hoping to pick up undecided voters,https://www.aljazeera.com/news/2024/10/21/early-voting-in-full-swing-in-us-election-harris-and-trump-tied-in-polls,Election Dynamics,Neutral
411,ABC News,David Brennan,"Biden's final months may offer conflict opportunities, even as Trump's return looms","President Joe Biden will see out his term knowing that President-elect Donald Trump -- a man he called a ""genuine danger to American security"" -- will succeed him.",https://abcnews.go.com/International/trumps-imminent-return-scuttle-bidens-plays-foreign-wars/story?id=115600631,Election Dynamics,Neutral
412,Business Insider,Bryan Metzger,The vulnerable GOP congressman convinced that economic interest voters will save him from the Trump and abortion backlash,"In Scottsdale, Rep. David Schweikert hopes an old-school GOP approach can help him hold onto a House district that's increasingly turning blue.",https://www.businessinsider.com/david-schweikert-profile-trump-realignment-arizona-economic-interests-abortion-2024-10,Election Dynamics,Neutral
413,Business Insider,atecotzky@businessinsider.com (Alice Tecotzky),Mark Cuban congratulates Trump — and Elon Musk — on winning the White House before the race is called,Mark Cuban congratulated Trump before he'd officially won the White House — but as a Harris victory was looked like an ever distant possibility.,https://www.businessinsider.com/mark-cuban-trump-elon-musk-kamala-harris-election-2024-11,Election Dynamics,Negative
414,Al Jazeera English,Al Jazeera,"US election: 2 days left – What polls say, what Harris and Trump are up to",Harris and Trump are locked in a dead heat in several swing states as one survey shows the Democrat leading in Iowa.,https://www.aljazeera.com/news/2024/11/3/us-election-2-days-left-what-polls-say-what-harris-and-trump-are-up-to,Election Dynamics,Neutral
420,Al Jazeera English,Al Jazeera,"Trump, Harris head west in election race for Latino votes in swing states","Both candidates hold events in the swing states of Arizona and Nevada, where Latino turnout could be key.",https://www.aljazeera.com/news/2024/10/31/trump-harris-head-west-in-election-race-for-latino-votes,Election Dynamics,Neutral
425,ABC News,Olivia Rubin,Pennsylvania election officials 'bracing' for onslaught of litigation,"In the battleground state of Pennsylvania, election officials are preparing for an onslaught of litigation that could flood the courts on Election Day and beyond.",https://abcnews.go.com/US/battleground-pennsylvania-election-officials-bracing-onslaught-litigation/story?id=115111489,Election Dynamics,Neutral
426,ABC News,Max Zahn,"Why inflation helped tip the election toward Trump, according to experts","Inflation has helped fuel a global backlash toward incumbents, experts say.",https://abcnews.go.com/Business/inflation-helped-tip-election-trump-experts/story?id=115601699,Election Dynamics,Negative
427,Al Jazeera English,Dorian Geiger,Excited and unnerved: New Yorkers flood the polls on US Election Day,"New York City may be a left-wing stronghold, but the diversity of its five boroughs paint a picture of a divided US.",https://www.aljazeera.com/news/2024/11/6/excited-and-unnerved-new-yorkers-flood-the-polls-on-us-election-day,Election Dynamics,Neutral
429,ABC News,"Peter Charalambous, Dara Elasfar",Election fact check: Minor voting glitches do not indicate widespread fraud,"When Americans vote Tuesday, some may encounter small issues like equipment malfunctions -- but experts stress that minor glitches don't indicate widespread voter fraud.",https://abcnews.go.com/US/election-fact-check-minor-glitches-isolated-polling-places/story?id=115392114,Election Dynamics,Neutral
430,ABC News,Sarah Beth Hensley,How to watch ABC News live coverage of 2024 election results,"Tune into ABC's live coverage and analysis of the 2024 election results throughout Election Day. Stream on all platforms on Tuesday, Nov. 5, starting at TK TIME.",https://abcnews.go.com/Politics/watch-abc-news-live-coverage-2024-election-results/story?id=115243138,Election Dynamics,Neutral
433,NBC News,NBC News,OVER 10 MILLION HAVE ALREADY VOTED!,"OVER 10 MILLION HAVE ALREADY VOTED! (Main headline, 1st story, link) Related stories:MAGA CLAIMS DOMINION FLIPPING",https://www.nbcnews.com/politics/2024-elections/early-vote,Election Dynamics,Neutral
434,Al Jazeera English,Al Jazeera Staff,US election polls: Trump vs Harris – who’s leading the race?,"With just days to go until Election Day, Harris and Trump are locked in a tight race.",https://www.aljazeera.com/news/2024/10/30/us-election-polls-trump-vs-harris-whos-leading-the-race,Election Dynamics,Neutral
435,Al Jazeera English,Al Jazeera,Trump and Harris hold final campaign rallies on eve of US election,"In final day of campaigning, Trump and Harris remain neck and neck, scrambling to win votes in crucial swing states.",https://www.aljazeera.com/news/2024/11/4/trump-and-harris-hold-final-campaign-rallies-on-eve-of-us-election,Election Dynamics,Neutral
438,Al Jazeera English,Sarah Shamim,US election 2024: Could Jill Stein determine whether Trump or Harris wins?,The Democrats and Trump alike think Stein could eat into the Harris vote. But what do the polls and history say?,https://www.aljazeera.com/news/2024/11/5/us-election-2024-could-jill-stein-determine-whether-trump-or-harris-wins,Election Dynamics,Neutral
441,Al Jazeera English,Al Jazeera,Trump visits McDonald’s as Harris speaks to churchgoers in swing state push,US presidential candidates zero in on battleground states of Pennsylvania and Georgia as Election Day nears.,https://www.aljazeera.com/news/2024/10/20/trump-visits-mcdonalds-as-harris-speaks-to-churchgoers-in-swing-state-push,Election Dynamics,Neutral
442,Al Jazeera English,Shola Lawal,US election: Did Trump gain Latino vote despite ‘floating garbage’ jibe?,"Long held up as a Democrat base, the Latino vote reflects a truer picture of a community that refuses political labels.",https://www.aljazeera.com/news/2024/11/6/us-election-did-trump-gain-latino-vote-despite-floating-garbage-jibe,Election Dynamics,Neutral
445,Time,Solcyré Burga,How the Electoral College Actually Works,A group of 538 electors are the only people who actually cast their ballot for President due to the Electoral College.,https://time.com/7096801/electoral-college-how-it-actually-works/,Election Dynamics,Neutral
447,Time,Alana Semuels,How the Economy is Doing in the Swing States,Some of the places faring especially well—and especially poorly—include the swing states expected to determine the election,https://time.com/7096021/economy-swing-states/,Election Dynamics,Neutral
448,Al Jazeera English,Al Jazeera Staff,A simple guide to the US election 2024,"From the primaries to the Electoral College, here's how to make sense of the 2024 US election.",https://www.aljazeera.com/features/2024/10/30/a-simple-guide-to-the-us-election-2024,Election Dynamics,Neutral
449,Al Jazeera English,Al Jazeera Staff,Trump vs Harris: Who’s leading in the US election polls as the vote looms?,We track the latest polls with less than two weeks to go before US voters choose a new president on November 5.,https://www.aljazeera.com/news/2024/10/23/trump-vs-harris-whos-leading-in-the-us-election-polls-as-the-vote-looms,Election Dynamics,Neutral
450,Al Jazeera English,Al Jazeera,"US election: 1 day left – What polls say, what Harris and Trump are up to","One day before Election Day, Trump and Harris focus on swing states as they aim to sway undecided voters.",https://www.aljazeera.com/news/2024/11/4/us-election-1-day-left-what-polls-say-what-harris-and-trump-are-up-to,Election Dynamics,Neutral
452,Al Jazeera English,Tyler Hicks,‘On the razor’s edge’: How North Carolina could decide the US presidency,Shifting demographics and a growing number of ‘unaffiliated’ voters have transformed North Carolina into a swing state.,https://www.aljazeera.com/news/longform/2024/10/31/on-the-razors-edge-how-north-carolina-could-decide-the-us-presidency,Election Dynamics,Neutral
454,CBC News,,Joe Biden to make 1st address after devastating election results for Democrats,"U.S. President Joe Biden is set to deliver an address Thursday about the election results, his first comments since Donald Trump defeated Vice-President Kamala Harris in the election and the Republicans retook control of the Senate, coming into effect in Janu…",https://www.cbc.ca/news/world/us-biden-election-remarks-1.7376446,Election Dynamics,Neutral
456,Al Jazeera English,Al Jazeera,"Harris, Trump hit North Carolina in final weekend push before US election","The fate of the election is expected to be determined by the seven battleground states, which are being heavily courted.",https://www.aljazeera.com/news/2024/11/2/harris-trump-hit-north-carolina-in-final-weekend-push-before-us-election,Election Dynamics,Neutral
461,Al Jazeera English,Al Jazeera,"Biden pledges ‘peaceful transition’, dodges ironies in US election defeat","Joe Biden offered Donald Trump congratulations on his election victory, and also tried to console Democrats.",https://www.aljazeera.com/news/2024/11/7/biden-pledges-peaceful-transition-dodges-ironies-in-election-defeat,Election Dynamics,Neutral
465,Al Jazeera English,Ali Harb,"US election 2024: Arab Americans united in grief, divided on strategy","Reeling from trauma of war on Gaza, Lebanon, community members say they face 'impossible choices' in upcoming election.",https://www.aljazeera.com/news/2024/11/4/us-election-arab-americans-united-in-grief-divided-on-strategy,Election Dynamics,Negative
