row_number,source,author,title,description,url,category,coverage
466,ABC News,G. Elliott Morris,2024 polls were accurate but still underestimated Trump,A modest error in his favor was enough to sweep the swing states.,https://abcnews.go.com/538/2024-polls-accurate-underestimated-trump/story?id=115652118,Election Dynamics,Neutral
469,Al Jazeera English,Ali Harb,Trump or Harris? Gaza war drives many Arab and Muslim voters to Jill Stein,Support for Green Party candidate grows as some voters stress the need to break away from Democrats and Republicans.,https://www.aljazeera.com/news/2024/11/4/trump-or-harris-gaza-war-drives-many-arab-and-muslim-voters-to-jill-stein,Election Dynamics,Negative
474,Al Jazeera English,Al Jazeera Staff,US election results: Key takeaways as Trump wins,"Trump makes inroads with Black voters; projected to win swing states North Carolina, Georgia, Pennsylvania and Wisconsin",https://www.aljazeera.com/news/2024/11/6/us-election-results-key-takeaways-as-trump-wins,Election Dynamics,Negative
482,ABC News,"Devin Dwyer, Sarah Herndon, Patty See",Poll watchers: Republicans tout 'deterrence' as election officials fear vigilantism,Distrust in the American election system among Republican voters has inspired a wave of poll watchers purporting to protect against fraud in battleground states.,https://abcnews.go.com/Politics/poll-watchers-republicans-tout-deterrence-election-officials-fear/story?id=115237914,Election Dynamics,Neutral
483,ABC News,"Oren Oppenheim, Julian Kim, Geoffrey Skelley",Here's how presidential election recounts work in key swing states,Here’s what to know about the rules that govern if and how presidential race recounts are conducted in each of the seven swing states.,https://abcnews.go.com/Politics/presidential-election-recounts-work-battleground-states/story?id=114992480,Election Dynamics,Neutral
489,Al Jazeera English,Al Jazeera,Investors on the watch for who will be next US president,Caution prevailed on Monday as the winner of the tightly contested presidential election may be unknown for days.,https://www.aljazeera.com/economy/2024/11/4/investors-on-the-watch-for-who-will-be-next-us-president,Election Dynamics,Neutral
490,Al Jazeera English,Al Jazeera,US agencies allege Russia link to video falsely claiming Georgia vote fraud,Russia has previously dismissed allegations it is attempting to interfere in US presidential election.,https://www.aljazeera.com/news/2024/11/1/us-agencies-allege-russia-link-to-video-falsely-claiming-georgia-vote-fraud,Election Dynamics,Neutral
492,Al Jazeera English,Sarah Shamim,US election: Who do world leaders prefer for president – Harris or Trump?,"From Putin to Xi Jinping, European and NATO leaders to India's Modi, who would world leaders prefer in the White House?",https://www.aljazeera.com/news/2024/11/1/us-election-who-do-world-leaders-prefer-for-president-harris-or-trump,Election Dynamics,Neutral
493,CBC News,,"U.S. citizens in Canada should vote electronically if they can, Democrat group warns","An arm of the Democratic party is warning U.S. citizens planning to vote from Canada of the impact a possible postal strike, and to vote electronically or send their ballot by courier.",https://www.cbc.ca/news/world/us-citizens-ballots-from-canada-1.7370222,Election Dynamics,Neutral
494,Al Jazeera English,Al Jazeera Staff,US election 2024 results: How Black voters shifted towards Trump,"Trump almost doubles support among Black voters compared with 2020, exit polls say. How and where? We break it down.",https://www.aljazeera.com/news/2024/11/6/us-election-2024-results-how-black-voters-shifted-towards-trump,Election Dynamics,Negative
496,Al Jazeera English,Al Jazeera,"Democrat Gallego wins Arizona, Republicans hold 53-47 US Senate majority","The last pending Senate race of the 2024 election has been called, meaning Republicans will hold a three-seat majority.",https://www.aljazeera.com/news/2024/11/12/democrat-gallego-wins-arizona-senate-race-defining-republican-majority,Election Dynamics,Negative
